{
  "status": "feasible",
  "assignments": [
    {
      "staff": "A01",
      "demand_id": "les:2026-09-18:S05:p1",
      "date": "2026-09-18",
      "start": 540,
      "end": 580,
      "mode": "normal",
      "pinned": false
    },
    {
      "staff": "A02",
      "demand_id": "les:2026-09-18:S07:p1",
      "date": "2026-09-18",
      "start": 540,
      "end": 580,
      "mode": "normal",
      "pinned": false
    },
    {
      "staff": "A01",
      "demand_id": "mv:2026-09-18:b1:1-3",
      "date": "2026-09-18",
      "start": 580,
      "end": 590,
      "mode": "normal",
      "pinned": false
    },
    {
      "staff": "A02",
      "demand_id": "mv:2026-09-18:b1:1-4",
      "date": "2026-09-18",
      "start": 580,
      "end": 590,
      "mode": "normal",
      "pinned": false
    },
    {
      "staff": "A01",
      "demand_id": "les:2026-09-18:S04:p2",
      "date": "2026-09-18",
      "start": 590,
      "end": 630,
      "mode": "normal",
      "pinned": false
    },
    {
      "staff": "A02",
      "demand_id": "les:2026-09-18:S03:p2",
      "date": "2026-09-18",
      "start": 590,
      "end": 630,
      "mode": "normal",
      "pinned": false
    },
    {
      "staff": "A03",
      "demand_id": "les:2026-09-18:S05:p2",
      "date": "2026-09-18",
      "start": 590,
      "end": 630,
      "mode": "normal",
      "pinned": false
    },
    {
      "staff": "A02",
      "demand_id": "mv:2026-09-18:b2:4-1",
      "date": "2026-09-18",
      "start": 630,
      "end": 640,
      "mode": "normal",
      "pinned": false
    },
    {
      "staff": "A03",
      "demand_id": "mv:2026-09-18:b2:1-2",
      "date": "2026-09-18",
      "start": 630,
      "end": 640,
      "mode": "normal",
      "pinned": false
    },
    {
      "staff": "A02",
      "demand_id": "mv:2026-09-18:b2:1-3",
      "date": "2026-09-18",
      "start": 640,
      "end": 650,
      "mode": "second_trip",
      "pinned": false
    },
    {
      "staff": "A02",
      "demand_id": "mv:2026-09-18:b3:4-1",
      "date": "2026-09-18",
      "start": 680,
      "end": 690,
      "mode": "normal",
      "pinned": false
    },
    {
      "staff": "A03",
      "demand_id": "mv:2026-09-18:b3:1-4",
      "date": "2026-09-18",
      "start": 680,
      "end": 690,
      "mode": "normal",
      "pinned": false
    },
    {
      "staff": "A01",
      "demand_id": "les:2026-09-18:S06:p4",
      "date": "2026-09-18",
      "start": 690,
      "end": 730,
      "mode": "normal",
      "pinned": false
    },
    {
      "staff": "A02",
      "demand_id": "les:2026-09-18:S03:p4",
      "date": "2026-09-18",
      "start": 690,
      "end": 730,
      "mode": "normal",
      "pinned": false
    },
    {
      "staff": "A01",
      "demand_id": "les:2026-09-18:S07:p5",
      "date": "2026-09-18",
      "start": 780,
      "end": 820,
      "mode": "normal",
      "pinned": false
    },
    {
      "staff": "A02",
      "demand_id": "les:2026-09-18:S03:p5",
      "date": "2026-09-18",
      "start": 780,
      "end": 820,
      "mode": "normal",
      "pinned": false
    },
    {
      "staff": "A02",
      "demand_id": "mv:2026-09-18:b5:4-1",
      "date": "2026-09-18",
      "start": 820,
      "end": 830,
      "mode": "normal",
      "pinned": false
    },
    {
      "staff": "A03",
      "demand_id": "les:2026-09-18:S02:p6",
      "date": "2026-09-18",
      "start": 830,
      "end": 870,
      "mode": "normal",
      "pinned": false
    }
  ],
  "shortfalls": [],
  "solver_meta": {
    "elapsed_ms": 840,
    "objective_stages": [
      0,
      0,
      0,
      4,
      0
    ],
    "message": "목데이터: 임시 규칙 엔진 결과를 그대로 넣음"
  }
}
